A1: Номер | B1: Таблица
A2: =ROW(A2)-1 -> 1 | B2: organizations
A3: =ROW(A3)-1 -> 2 | B3: equipmanufacturers
A4: =ROW(A4)-1 -> 3 | B4: antennplaces
A5: =ROW(A5)-1 -> 4 | B5: storageplaces
A6: =ROW(A6)-1 -> 5 | B6: financecategories
A7: =ROW(A7)-1 -> 6 | B7: adminregiontypes
A8: =ROW(A8)-1 -> 7 | B8: superregions
A9: =ROW(A9)-1 -> 8 | B9: regions
A10: =ROW(A10)-1 -> 9 | B10: adminregions
A11: =ROW(A11)-1 -> 10 | B11: netzones
A12: =ROW(A12)-1 -> 11 | B12: resourceclasses
A13: =ROW(A13)-1 -> 12 | B13: resourcetypes
A14: =ROW(A14)-1 -> 13 | B14: resourcesubtypes
A15: =ROW(A15)-1 -> 14 | B15: resources
A16: =ROW(A16)-1 -> 15 | B16: repiterres
A17: =ROW(A17)-1 -> 16 | B17: antennares
A18: =ROW(A18)-1 -> 17 | B18: antennaresband
A19: =ROW(A19)-1 -> 18 | B19: positions
A20: =ROW(A20)-1 -> 19 | B20: equipment
A21: =ROW(A21)-1 -> 20 | B21: switches
A22: =ROW(A22)-1 -> 21 | B22: controllers
A23: =ROW(A23)-1 -> 22 | B23: basestations
A24: =ROW(A24)-1 -> 23 | B24: bsstands
A25: =ROW(A25)-1 -> 24 | B25: sectors
A26: =ROW(A26)-1 -> 25 | B26: antennes
A27: =ROW(A27)-1 -> 26 | B27: antennesworkbands
A28: =ROW(A28)-1 -> 27 | B28: anten2sectors
A29: =ROW(A29)-1 -> 28 | B29: repiters
A30: =ROW(A30)-1 -> 29 | B30: bsnumbers
A31: 30 | B31: join_db_query